{
  "$schema": "./hera.schema.json",
  "disabled_agents": [],
  "disabled_skills": [],
  "disabled_tools": [],
  "agent_overrides": {},
  "templates": {
    "custom-analyst": {
      "label": "Data Analyst",
      "description": "Analyzes data and generates insights",
      "defaultMode": "subagent",
      "defaultSkills": ["caveman", "init", "memory", "evolution"],
      "prompt": "You are a data analyst. Analyze data, identify patterns, generate insights. Focus on: statistical analysis, data visualization, trend identification, actionable recommendations."
    }
  },
  "auto_evolve": false,
  "memory_limit": 1000,
  "team_defaults": {
    "coordination": "parallel",
    "timeout": 300000
  }
}
